{"schema_version":1,"subject_id":"phase5-critical","package_digest":"sha256:4ff198845e832732eb5813d25bb349a6d3052535ef93a97d070f616e86da59ad","assignment_digest":"sha256:90d9a16a325d64a89822a2a755db037ae2541f01a7e7bf8d82ecc48be86fa13d","acceptance_criteria":["criterion-atomic-activation"],"approver_id":"human-security-reviewer","decision":"APPROVE","created_at":"2026-07-24T01:11:00Z","approval_digest":"sha256:16bad814a0aa610f2b77ecf2b7fe430ffb37f998e15b46e24fe8f2fb7abe9f25"}
